{
  "$schema": "http://json-schema.org/draft-06/schema#",
  "configValues": {
    "invite": {
      "id": "did:trust:tc:dev:id:XLzBJ69tqEgq7oqqCLiEnT",
      "secret": "client",
      "endpoint": "http://localhost:3520"
    },
    "name": "client",
    "keyPairs": []
  },
  "filePath": "../../tmp/testFile.json",
  "cloud": "http://localhost:3223",
  "creator": "http://localhost:3222",
  "network": {
    "gateways": ["http://localhost:3520"],
    "observers": ["http://localhost:3530"],
    "namespace": "tc:test"
  }
}
